{
  "availability": "public",
  "channel_id": "UCvv1D2u1q224apjc5OP_1ug",
  "description": null,
  "discovered_at": "2026-08-22T09:45:04Z",
  "duration": 1687,
  "extraction_status": "BLOCKED_BY_YOUTUBE",
  "live_status": null,
  "published_at": null,
  "thumbnail": null,
  "title": "【第177期】熊猫教练本人第2套交易系统大公开（下集）| 价格行为 | 缠论 | 走势类型 | 顺大逆小 | 如果回到10年前",
  "url": "https://www.youtube.com/watch?v=_4B8U6ytXdU",
  "video_id": "_4B8U6ytXdU"
}
