{
  "availability": "public",
  "channel_id": "UCvv1D2u1q224apjc5OP_1ug",
  "description": null,
  "discovered_at": "2026-08-22T09:45:04Z",
  "duration": 1133,
  "extraction_status": "BLOCKED_BY_YOUTUBE",
  "live_status": null,
  "published_at": null,
  "thumbnail": null,
  "title": "第6章（回调结构）第1讲：认识回调（1-6-1）",
  "url": "https://www.youtube.com/watch?v=nAW1RJhFI00",
  "video_id": "nAW1RJhFI00"
}
