{
  "availability": "public",
  "channel_id": "UCvv1D2u1q224apjc5OP_1ug",
  "description": null,
  "discovered_at": "2026-08-22T09:45:04Z",
  "duration": 357,
  "extraction_status": "RETRYABLE_FAILED",
  "live_status": null,
  "published_at": null,
  "thumbnail": null,
  "title": "如何抄底519的GMT？做交易千万不可削足适履、不可拿来主义、不可拿来就用，用完就亏，亏完就骂！",
  "url": "https://www.youtube.com/watch?v=OFscVOT8AQA",
  "video_id": "OFscVOT8AQA"
}
