{
  "availability": "public",
  "channel_id": "UCvv1D2u1q224apjc5OP_1ug",
  "description": null,
  "discovered_at": "2026-08-22T09:45:04Z",
  "duration": 2142,
  "extraction_status": "BLOCKED_BY_YOUTUBE",
  "live_status": null,
  "published_at": null,
  "thumbnail": null,
  "title": "【SMC订单流】第3讲：供应和需求（上集）",
  "url": "https://www.youtube.com/watch?v=ZizVOlf4Aeo",
  "video_id": "ZizVOlf4Aeo"
}
