{
  "availability": "public",
  "channel_id": "UCvv1D2u1q224apjc5OP_1ug",
  "description": null,
  "discovered_at": "2026-08-22T09:45:04Z",
  "duration": 583,
  "extraction_status": "BLOCKED_BY_YOUTUBE",
  "live_status": null,
  "published_at": null,
  "thumbnail": null,
  "title": "【第87期】如何寻找支撑压力位 2.0版本（上） /支撑压力位/关键位/止盈止损/外汇/虚拟货币 /孤立高点 /孤立低点 /孤立支点 /量价分析 /威科夫",
  "url": "https://www.youtube.com/watch?v=8IuJGeiu6Ao",
  "video_id": "8IuJGeiu6Ao"
}
