{
  "availability": "public",
  "channel_id": "UCvv1D2u1q224apjc5OP_1ug",
  "description": null,
  "discovered_at": "2026-08-22T09:45:04Z",
  "duration": 1339,
  "extraction_status": "RETRYABLE_FAILED",
  "live_status": null,
  "published_at": null,
  "thumbnail": null,
  "title": "粉丝答疑第4期：如何区分顺势还是逆势？如何识别相对反转和绝对反转？  比特币/比特币交易/比特币合约/以太坊/外汇/做空被套",
  "url": "https://www.youtube.com/watch?v=wlVQ3UXaG4I",
  "video_id": "wlVQ3UXaG4I"
}
