{
  "availability": "public",
  "channel_id": "UCvv1D2u1q224apjc5OP_1ug",
  "description": null,
  "discovered_at": "2026-08-22T09:45:04Z",
  "duration": 2237,
  "extraction_status": "RETRYABLE_FAILED",
  "live_status": null,
  "published_at": null,
  "thumbnail": null,
  "title": "粉丝答疑第10期：小白常见错误（第4集）",
  "url": "https://www.youtube.com/watch?v=MTesY3jBWL8",
  "video_id": "MTesY3jBWL8"
}
