{
  "availability": "public",
  "channel_id": "UCvv1D2u1q224apjc5OP_1ug",
  "description": null,
  "discovered_at": "2026-08-22T09:45:04Z",
  "duration": 957,
  "extraction_status": "BLOCKED_BY_YOUTUBE",
  "live_status": null,
  "published_at": null,
  "thumbnail": null,
  "title": "第2期 自己的坑，还是得自己踩 (20260403-周五直播课切片)  | 直播读图 | 过滤噪音 | 保持清醒 | 教练带着学员读图",
  "url": "https://www.youtube.com/watch?v=AJYbSqcySjE",
  "video_id": "AJYbSqcySjE"
}
