{
  "availability": "public",
  "channel_id": "UCvv1D2u1q224apjc5OP_1ug",
  "description": null,
  "discovered_at": "2026-08-22T09:45:04Z",
  "duration": 1396,
  "extraction_status": "BLOCKED_BY_YOUTUBE",
  "live_status": null,
  "published_at": null,
  "thumbnail": null,
  "title": "第5章（其他市场常见形态）第4讲：楔形、旗形（1-5-4）",
  "url": "https://www.youtube.com/watch?v=sBZFSCiHHV0",
  "video_id": "sBZFSCiHHV0"
}
