{
  "availability": "public",
  "channel_id": "UCvv1D2u1q224apjc5OP_1ug",
  "description": null,
  "discovered_at": "2026-08-22T09:45:04Z",
  "duration": 806,
  "extraction_status": "BLOCKED_BY_YOUTUBE",
  "live_status": null,
  "published_at": null,
  "thumbnail": null,
  "title": "【第160期】什么是订单管理？如何做订单管理？（上集） | 防止卖飞 | 防止回撤较大 | 订单管理的优缺点",
  "url": "https://www.youtube.com/watch?v=SNt6DfojptA",
  "video_id": "SNt6DfojptA"
}
