{
  "availability": "public",
  "channel_id": "UCvv1D2u1q224apjc5OP_1ug",
  "description": null,
  "discovered_at": "2026-08-22T09:45:04Z",
  "duration": 806,
  "extraction_status": "BLOCKED_BY_YOUTUBE",
  "live_status": null,
  "published_at": null,
  "thumbnail": null,
  "title": "【第83期】“王五出场” 逐K分析（3）,第77期故事后续连载中...#比特币 #比特币合约 #比特币交易 #技术分析 #价格行为 #裸k #熊猫教练",
  "url": "https://www.youtube.com/watch?v=ak3k6s4Z1wo",
  "video_id": "ak3k6s4Z1wo"
}
