{
  "availability": "public",
  "channel_id": "UCvv1D2u1q224apjc5OP_1ug",
  "description": null,
  "discovered_at": "2026-08-22T09:45:04Z",
  "duration": 425,
  "extraction_status": "BLOCKED_BY_YOUTUBE",
  "live_status": null,
  "published_at": null,
  "thumbnail": null,
  "title": "【第265期】稳定盈利是谎言 | 财商 | 理财 | 富爸爸穷爸爸 | 资产 | 负债",
  "url": "https://www.youtube.com/watch?v=-PFO8Uophfg",
  "video_id": "-PFO8Uophfg"
}
