{
  "availability": "public",
  "channel_id": "UCvv1D2u1q224apjc5OP_1ug",
  "description": null,
  "discovered_at": "2026-08-22T09:45:04Z",
  "duration": 2054,
  "extraction_status": "BLOCKED_BY_YOUTUBE",
  "live_status": null,
  "published_at": null,
  "thumbnail": null,
  "title": "第5讲：蝴蝶形态及变异",
  "url": "https://www.youtube.com/watch?v=kunwV1LYeU0",
  "video_id": "kunwV1LYeU0"
}
