{
  "availability": "public",
  "channel_id": "UCvv1D2u1q224apjc5OP_1ug",
  "description": null,
  "discovered_at": "2026-08-22T09:45:04Z",
  "duration": 1496,
  "extraction_status": "BLOCKED_BY_YOUTUBE",
  "live_status": null,
  "published_at": null,
  "thumbnail": null,
  "title": "【第47期】稳定获利四件套 之 数K线？怎么数K线？",
  "url": "https://www.youtube.com/watch?v=92bPPboE25o",
  "video_id": "92bPPboE25o"
}
