{
  "availability": "public",
  "channel_id": "UCvv1D2u1q224apjc5OP_1ug",
  "description": null,
  "discovered_at": "2026-08-22T09:45:04Z",
  "duration": 524,
  "extraction_status": "BLOCKED_BY_YOUTUBE",
  "live_status": null,
  "published_at": null,
  "thumbnail": null,
  "title": "【第197期】快速上涨时如何用简单回调买入 | 价格行为 | 裸K | 简单回调 | 科学追涨",
  "url": "https://www.youtube.com/watch?v=_3cwXCPXlDE",
  "video_id": "_3cwXCPXlDE"
}
