{
  "availability": "public",
  "channel_id": "UCvv1D2u1q224apjc5OP_1ug",
  "description": null,
  "discovered_at": "2026-08-22T09:45:04Z",
  "duration": 618,
  "extraction_status": "BLOCKED_BY_YOUTUBE",
  "live_status": null,
  "published_at": null,
  "thumbnail": null,
  "title": "【第93期】如何计算仓位大小？如何计算本次交易规模？   价格行为/仓位管理/仓位计算器",
  "url": "https://www.youtube.com/watch?v=YG1Wavp3_SQ",
  "video_id": "YG1Wavp3_SQ"
}
