{
  "availability": "public",
  "channel_id": "UCvv1D2u1q224apjc5OP_1ug",
  "description": null,
  "discovered_at": "2026-08-22T09:45:04Z",
  "duration": 2089,
  "extraction_status": "BLOCKED_BY_YOUTUBE",
  "live_status": null,
  "published_at": null,
  "thumbnail": null,
  "title": "粉丝答疑第7期：小白常见错误（第1集）",
  "url": "https://www.youtube.com/watch?v=KMqHaFr4uxg",
  "video_id": "KMqHaFr4uxg"
}
