{
  "availability": "public",
  "channel_id": "UCvv1D2u1q224apjc5OP_1ug",
  "description": null,
  "discovered_at": "2026-08-22T09:45:04Z",
  "duration": 528,
  "extraction_status": "BLOCKED_BY_YOUTUBE",
  "live_status": null,
  "published_at": null,
  "thumbnail": null,
  "title": "【第249期】如何避免假突破 | 真突破 | 假突破 | 最佳方案",
  "url": "https://www.youtube.com/watch?v=-MfUGsa8RK4",
  "video_id": "-MfUGsa8RK4"
}
