{
  "availability": "public",
  "channel_id": "UCvv1D2u1q224apjc5OP_1ug",
  "description": null,
  "discovered_at": "2026-08-22T09:45:04Z",
  "duration": 930,
  "extraction_status": "RETRYABLE_FAILED",
  "live_status": null,
  "published_at": null,
  "thumbnail": null,
  "title": "【第273期】学会忘掉你的止损 | 止损 | 交易计划 | 如何正确面对止损 | 三个步骤 | 市场认知",
  "url": "https://www.youtube.com/watch?v=wUSevcuKRRI",
  "video_id": "wUSevcuKRRI"
}
