{
  "availability": "public",
  "channel_id": "UCvv1D2u1q224apjc5OP_1ug",
  "description": null,
  "discovered_at": "2026-08-22T09:45:04Z",
  "duration": 1207,
  "extraction_status": "BLOCKED_BY_YOUTUBE",
  "live_status": null,
  "published_at": null,
  "thumbnail": null,
  "title": "【第157期】超高胜率的MACD只吃一口战法（下集） | MACD | 订单管理 | 不想卖飞 | 分辨趋势 | 2024年04月07日“免费的课”  公开课",
  "url": "https://www.youtube.com/watch?v=5fAUmZsAdAY",
  "video_id": "5fAUmZsAdAY"
}
