{
  "availability": "public",
  "channel_id": "UCvv1D2u1q224apjc5OP_1ug",
  "description": null,
  "discovered_at": "2026-08-22T09:45:04Z",
  "duration": 485,
  "extraction_status": "BLOCKED_BY_YOUTUBE",
  "live_status": null,
  "published_at": null,
  "thumbnail": null,
  "title": "【第258期】究竟该抄底还是该做空 | 抄底 | 做空 | 回调 | 踏空 | 入场三问",
  "url": "https://www.youtube.com/watch?v=LTBOm37Q1l0",
  "video_id": "LTBOm37Q1l0"
}
