{
  "availability": "public",
  "channel_id": "UCvv1D2u1q224apjc5OP_1ug",
  "description": null,
  "discovered_at": "2026-08-22T09:45:04Z",
  "duration": 811,
  "extraction_status": "RETRYABLE_FAILED",
  "live_status": null,
  "published_at": null,
  "thumbnail": null,
  "title": "【2024年10月】数字货币市场10月行情展望 | BTC | ETH | STX | ACE | SUI | PYTH | NFP",
  "url": "https://www.youtube.com/watch?v=t5UZtolc5Jg",
  "video_id": "t5UZtolc5Jg"
}
