{
  "availability": "public",
  "channel_id": "UCvv1D2u1q224apjc5OP_1ug",
  "description": null,
  "discovered_at": "2026-08-22T09:45:04Z",
  "duration": 98,
  "extraction_status": "RETRYABLE_FAILED",
  "live_status": null,
  "published_at": null,
  "thumbnail": null,
  "title": "【第14期】加仓和补仓的区别",
  "url": "https://www.youtube.com/watch?v=voW1WZx5sGY",
  "video_id": "voW1WZx5sGY"
}
